chapter,start_page,end_page,summary
Overview and Recommendations,17,26,"Here is a summary of Chapter Overview and Recommendations in less than 100 words:

Turkey's economic growth has been strong since 2002, with an average annual rate of 7.5%. However, social progress has been lacking, including in education, employment, and gender equality. The country's youth are vulnerable to unemployment, with a high youth unemployment rate. Vocational education is underdeveloped, and the government's effectiveness in addressing youth needs has been limited. To achieve sustainable development, Turkey must address these social challenges, investing in education, skills creation, and governance, as well as promoting gender equality and reducing inequality. This will ensure that economic growth benefits all members of society."
Chapter 1 Youth Policy in Turkey,27,40,"Here is a summary of Chapter 1 Youth Policy in Turkey in under 100 words:

In Turkey, youth policy has historically focused on visible young people, neglecting the needs of ""invisible"" youth, particularly young women. This group includes those who are isolated from social life due to domestic obligations, lack skills for urban employment, or are victims of human trafficking. Despite being a minority, this group is disproportionately affected and requires targeted policies to increase their opportunities for education, resources, and full development. The chapter highlights the need to recognize diversity and adapt policies to address the unique needs and realities of ""invisible"" youth in Turkey."
Chapter 2 Education Opportunities for Youth,41,56,"Here is a summary of Chapter 2 ""Education Opportunities for Youth"" in under 100 words:

Turkey's expenditure on education is low compared to OECD countries, with $40,000 spent per primary student. Despite an increase in compulsory education years, net enrolment rates are below the country-level average, especially in Southeastern Anatolia and Northeastern Anatolia regions. Only 56% of young people continue high school after primary school, and only 18% attend university directly after graduation. Gender roles also influence education choices, with more young men forced into work due to family pressure than young women. Pre-school education is limited, with approximately 20% of children receiving early childhood education."
Chapter 3 Young and Healthy,57,68,"Here is a summary of Chapter 3 ""Young and Healthy"" in under 100 words:

Turkish adolescents face various challenges, including poverty, lack of life skills education, substance abuse, and violent conflicts at home or school. Girls, particularly those from low-income families, are also affected by child marriage and early parenthood. Gender disparities exacerbate these issues, with girls facing unequal access to education and healthcare compared to boys. The chapter highlights the need for targeted support and policies to address these challenges, ensuring that adolescents develop their natural capacities in a safe and supportive environment. This is crucial for their well-being and future development."
Chapter 4 Youth Unemployment,69,90,"Here is a summary of Chapter 4: Youth Unemployment in less than 100 words:

In Turkey, youth unemployment remains a significant challenge despite strong economic growth. The country's labour market has unique features, including an unusually high share of agricultural employment and low average education levels. Labour force participation rates have been falling across all education groups, but the overall trend is expected to turn upwards as young people enter higher education levels with better job prospects. Urban youth unemployment rates are particularly high, affecting both men and women, with young women facing a significant gap in labour market participation. The economy's recent growth has not translated into increased employment creation."
Chapter 5 Participation,91,100,"Here is a summary of Chapter 5 Participation in less than 100 words:

In Turkey, youth participation in social life is hindered by economic, attitudinal, cultural, and strictly political factors. This affects their development and ability to contribute to national Human Development. The lack of adequate education and socialization can lead to inadequate understanding of citizenship rights and duties, resulting in suspicion and mistrust towards fellow citizens. The State of Youth Survey reveals low levels of youth participation in family decisions, even on everyday matters. To promote active citizenship, institutions must create an environment that encourages intergenerational dialogue and empowers young people to make a say in decision-making processes."
Chapter 6 Vision for the Future,101,112,"Here is a summary of Chapter 6 ""Vision for the Future"" in under 100 words:

Turkey has a 15-year window of demographic opportunity from 2023 to 2040, with about 70% of its population expected to be of working age. Young people will form the majority of decision-makers by 2023. To prepare for the challenges ahead, Turkey needs to invest in advanced skills and education. The country has made significant progress since its foundation but still faces unfinished agenda items, including human development, income distribution, social solidarity, and human rights. Setting specific goals is necessary to realize a vision for Turkey's 100th anniversary in 2023."
